{
  "$schema": "../contracts/schemas/run-authorization.pending.schema.json",
  "schema_version": "1.0.0",
  "contract_schema_id": null,
  "contract_schema_sha256": null,
  "run_id": null,
  "authorization_id": null,
  "decision": "pending",
  "actor": null,
  "selected_writer": null,
  "issued_at": null,
  "expires_at": null,
  "delivery_target": "local_verified",
  "health_profile": "local_verified",
  "health_attestation": null,
  "resource_plan": [],
  "repository": null,
  "spec_kit": null,
  "acceptance_ids": [],
  "allowed_paths": [],
  "limits": {
    "max_implementation_attempts": 3,
    "max_review_cycles": 2,
    "max_transient_retries": 1,
    "active_wall_minutes": 45,
    "async_wait_minutes": 45
  },
  "github": null,
  "apple": null,
  "action_grants": [],
  "forbidden_actions": [
    "git.force_push",
    "github.auto_merge",
    "github.ruleset_change",
    "apple.app_review_submit",
    "apple.production_release",
    "apple.signing_resource_mutation",
    "credential.scope_expansion",
    "environment.destructive_cleanup"
  ],
  "auto_merge": false,
  "app_review_submit": false,
  "credential_scope_expansion": false,
  "signing_resource_mutation": false,
  "destructive_cleanup": false,
  "local_requirements": {
    "review_required": false,
    "spec_kit_required": false
  }
}
